URL,Text,Real Result
algotradingbridge.in,"automated order placement for your algorithmic trading strategies we offer a web based api bridge for automatic algo trading of your tradingview strategies. we do not store any strategy or order related data on our system. run strategy on your chosen platform suitable for retail traders and investors our trading bridge intelligently converts your strategy's webhook signal into the broker's api interface, executing the trade send strategy signals to trading bridge configure your strategy platform to send alerts to our trading bridge using webhook. bridge will process incoming signals and place orders with configured brokers using fast api protocol. v ) ce fast is your trading bridge? trading bridge?",No.
bitcoinxchange.ru,"the difference ~ now! making in the crypto rise trade 3 hours duration enjoy the convenience of instant cashouts with our pane etree teen investinglab today for a seamless and rewarding trading experience! rise trade 20 min duration join now, diversify your investments, and seize the embrace thi youre sate of hands-off trading and enjoy t ards with investinglab's financial advisors at the helm security of your digital assets is paramount. e dogecoin +$135.45 st ay win eo bitcoin +$178.95 win oo 14 © tir advanced analytics portfolio seamless trading make informed decisions using keep track of your investments with e a streamlined and comprehensive market insights. vis my data and assets secure? register for free now!",No.
bitcoinlatestnews.today,"@eurcany cates ew mining the bitcoin isn’t the only way to get your bitcoins. the simplest way to get bitcoin is to buy it from the cryptocurrency exchange. buying bitcoins needs you to follow some procedure, which includes establishing an account with one of the major crypto-exchanges like coinbase, connecting the bank account, and transferring the money to buy bitcoins. if privacy is your topmost concern, then buying bitcoin with cash is your best bet, there are platforms like paxful and localbitcoins, which connects buyers and sellers and enables you to trade cash or gift card in person for bitcoin. sports betting guide: how to use bitcoin for online betting? el salvador’s ‘bitcoin city’ plans thrown into doubt bitcoin, the leading cryptocurrency, has been naylb bukele, the president of el salvador, facing a downfall in the last month after read the bitcoin predictions from cryptonewsz and stay informed about the future prices and future market of bitcoin. a roy",No.
bitcoin-trading.io,"10 best cryptocurrency exchanges in the uk (2023)what's in this guide?trading in cryptocurrencies is popular. and which bitcoin ‘exchange in the netherlands is the best? top 10 best crypto before they go mainstream: blockchain futurist conference showcases top web3 speakers and emerging trends for 5 years azuma coin [azum] review of project before they go mainstream: blockchain futurist conference showcases top web3 speakers and emerging trends for 5 years wkkkk minimal review deposit in the ever-evolving world of cryptocurrency, staying ahead of the curve is paramount. as traders seek to maximize their © built in trading bots @ comfortable platform and quick start @ wide range of pricing plans and 7-day bitcoin-trading.io is a portal about cryptocurrencies, bitcoin, ethereum and altcoins.",No.
bestcryptodividends.com,"if your on the lookout for cryptocurrency tokens that can provide you with an easy way to make passive income, either from staking or hodling in your wallets, then you have found yourself some luck. if you want to get an idea of the dividend you could receive on your investment? summary * dividend payout: dependant on how many kucoin shares tokens you hold * payout period: daily * where to buy: kucoin exchange * dividend calculator: kucoin dividend calculator summary * dividend payout: dependant on how many bitmax tokens you hold * payout period: daily * where to buy: bitmax exchange * dividend calculator: bitmax dividend calculator similar to kucoin the exchange shares 50% of trading fees with holders of the token. summary * dividend payout: dependant on how many coss tokens you hold * payout period: weekly (monday) * where to buy: coss exchange & hitbtc * dividend calculator: coss dividend calculator to receive the weekly dividends which are paid in the form of ethereum tokens, you will need to purchase and lock a minimum of 500 bix tokens on the exchange and then every friday you will get a dividend payment just in time for the weekend. summary * dividend payout: dependant on how many bibox tokens you hold * payout period: weekly (friday) * where to buy: bibox exchange & huobi pro * dividend calculator: bibox dividend calculator summary * dividend payout: for every neo you have, you generate 0.0003 gas per day * payout period: daily or monthly (binance & kucoin) * where to buy: binance, kucoin exchange, bibox, bitfinex, huobi pro & others * dividend calculator: neo dividend calculator pundi x is one of the most exciting projects in the market and has a great opportunity to break boundaries with the use of their xpos device. we currently feature dividend calculators for kucoin (kucoin), bibox (bibox) and coss (coss), bitmax (btmx),",No.
bitcoinmaxinews.com,bitcoin is a database the year of bitcoin etfs: how 2024 can shape the future of finance new to bitcoin? vast amount of educational resources to lear all about the power of bitcoin free bitcoin and “what is money” courses and deep dives educational bitcoin talk show with guests an interactive show about bitcoin and freedom tech the what is money show what is a bitcoin spot etf? get your salary in btc from anywhere sell/buy crap for #sats,No.
bitcoincityjan3.com,welgometobitcoincityjans vole ty ts oa es pg preeti chil pill while our pree) c esis teele) solid platform for investment be a = 35689013.45 oe elem in [da s10) ee ec) © a ee,No.
assetmanagementagents.com,"chris bell is an asset manager for black enterprises and the exclusive agent of the estate of harlan d ... newport highway, spokane police sent six patrol officers and a supervisor to help manage lines of... the times/the sunday times 21 jan 2024 galaxy asset management, specifically, consists of a team of dedicated, seasoned ... galaxy ‘asset management is the galaxy division that operates galaxy digital funds, the execution agent of btco, it’s a significant improvement that will make things easier for asset managers, as well as the agents and brokers who work with them to secure appropriate coverage.” ... asset management professional services insurance finance. guggenheim investments is the global asset management and investment advisory division of guggenheim partners, llc (""guggenheim""), with over $218 billion* in assets under management across fixed income, equity, and alternative strategies. prior to this, on 26 september, sebi had extended the deadline to 31 december.the move is almed at helping investors to secure their assets and pass them on to their legal heirs.’based on... = goods will be sold for cash by cubesmart asset management, llc as agent for owner 5861s. ina story recently published in the los angeles times, dodgers beat reporter jack harris quoted an unnamed agent who speculated that the team could make an additional $1 billion by investing the deferrals with an asset management company. 29 jan 2024 31 jan 2024 31 jan 2024",No.
700capital.se,a er oe ten ere scl rie se ucar id) it’s your future: build a financial picture that fits your goals see re me rene mien ree cc) (chfcs) and more. we apply the same principles to see ae al your lio that investment peete tat] een rcn a oe lending a find the b ray eer \ a) ray cg .w7 der cr aa) ee a] damo et) pear ac pant) de gt) see more ce oe,No.
44ten.finance.blog,"44 ten capital founded in april 2015, 44ten capital has since risen to become one of the top investment firms that focus on investing in cryptocurrencies, digital tokens, and blockchain companies. its managed assets under management (aum) reached more than ns2 million, making it one of the top crypto asset management companies in namibia. what we do l,we are leal alah ed steps to make this ctntelws it ay=4 marke t more fvelel 13 sible not only to invest elas) and talaalee yr r irs) but also to the tall al felele) item watchin) ty newco 1p f=ahe1| assets , such fas} crypto curre ney or nae and the ve) (eta ola ko close al, and the tnakea toh erse are fet chang ers. these are no keyar=<elu ila fetche (o} ito[=t-ks} crypto and other digital assets are nt etu) to kw scr re au oe aa re rrm ae oe elele] <cmawe) leg",Yes.
alphatradeinvest.com,"the better way to trade & invest alpha trade invest is a top private investment firm ; offering asset management services, crypto z} oa ee ol) ethereum [e alpha trade invest uses the highest levels of internet two-fact entication (2fa) by default on all alph security, and it is y 256 bits ssl security trade invest account: ecurely protect you from encryption to ensure that your information is y and impersonation possible deposit: $200 min. possible deposit: $500 min. fered, subscribed to her trading the better way to trade & invest alpha trade invest is one of the leading private investment firms providing asset management services on the internet including bitcoin mining program, cryptocurrency earning, exchange and crypto assets cu aa ac rc nmc sro rau e de ea e reece mes eae eect poe emel ae ron aca er a ae bes cn os renee cera canned ea er rota rate marea aot wires ne ec wp)",Yes.
binarytraders.pro,"invest tod em, get started > cryptocurrenc j and fast growing trading company!| lad bitcoin, alongside a majority of its counterparts in ti eeuereommaiel el rel eres xe neck ien cryptocurrency mining encompasses dual functionalities: the incorporation blockchain, entailing their security and verification, and the issuance of ne\ pivotal role in fortifying the network and facilitating transaction processing. un cay vl total acco! na fe) a ee) oman scrcurela we et (ecole roe et a once te a et jan. 16 a.",No.
bitcoinfund.beacons305.com,"swan is the best way to accumulate bitcoin with automatic recurring and instant buys using your bank join today to get $10 of free bitcoin in your account. = swan with swan, your bitcoin specialists we created this free 1-hour course to welcome you to bitcoin in a simple and friendly way. bitcoin 101 ‘swan is the best and | recommend this exchange even if you are new to this! #bitcoin is the future of money and it is the future they are authentic, and driven in their pursuit of spreading the good word about the virtues of bitcoin, and have been a steadfast champion in the community with respect to education. if you don't already dca into bitcoin, swan makes it easy to #stack #btc low fees, automatic savings plans, instant buys, and most importantly free withdrawals to your own cold storage. luse swan bitcoin as the best way to dca into bitcoin.",Yes.
bitcoingoldcode.com,"we wanted to make sure that no matter how much experience you have with online trading, you can use our sophisticated trading software with ease. the software's algorithm is one of the most advanced on the market today, allowing it to the bitcoin gold code is a real trading app that has won the respect of trade specialists all around the world. cee cama es ie ce esse? how much prior trading experience do | need to use the bitcoin gold code app? to begin trading with the bitcoin gold code app, you do not need any prior experience. if you have the bitcoin gold code app installed on your device, and your device is connected to the internet, then you can get started with trading. our objective was to make the bitcoin gold code app as user-friendly as possible. the first investment is only £250, and this money will be used to fund your trading account. there is no upper limit to how much money you can make with the bitcoin gold code trading software. we cannot, however, promise that you will be overall profitable because cryptocurrency markets are notorious for high levels of volatility.",Yes.
acefinance.org,"acefinance is an award winning forex and commodities broker, providing trading services and facilities to both retail and institutional clients. acefinance gives you access to trading forex as you can execute your buy and sell orders on their trading platforms. weare doing really good at this market and here are the words we loved to get from a few of our users. my name is andrew macauley, few weeks ago i traded with acefinance, | made enough profit of 2.8btc and my withdrawal was processed instantly. acefinance are the best. giving you guys 5 star rating for your support and services. confirm your account and go to the login page, input your details and you can now explore your account. to start growing your capital, you need to make a deposit. you can do this from the deposit section of your account. there are investment plans ranging from hourly profit depending on the amount of your deposit. the minimum deposit is $500, and you are allowed to make as many deposit as you want.",Yes.
asianbankingandfinance.net,"asian banking & 1 day ago. in association with g9 smartstream mastercard on why biometrics is the future of secure payments today it’s a finger how banks can ensure customer safety in gen al adoption gen alis expected to add up to us$340b in new value to banks. is the future of banking al-powered and personalised? the financial services world of the future transform and modernise with an effective hybrid cloud strategy asian banking & finance awards ey bre commentary 2024 opens nominations for financial technology outstanding navigating the fintech banks, finance ey oe companies a how 2024 will spark financial services award sites innovation in southeast asia ak ae ~ qa es amnefimne a ne partner sites om |/ ko"" eam ee abf retail banking ~abf wholesale abf corporate & awards banking awards investment banking awards singapore business review event sites ceo justin quek steers orangetee to",No.
bitcoinseedinvest.com,oro e ue te soa re een ree etn ee oe re een ae melee peet gens ge eee son oa uae col i h/o ee oe ee ge ce reo (eae ee bea ee a eae seco eae una & long-term goals eq m(xale-le rsa oa h 16] & blockchain technology our investment plans ee om we're global naa noe rita atte reet nea we are dedicated to your ve ie the bitcoin seed excha me ere koe me a enkei ne to shake off the eee mec ete eae ae the winners! ce ae,Yes.
avoninvestments.net,"invest and safeguard your assets with the teo me, reputable we possess all the transparency regarding and instant trading security and customer conduct trading for our services. your security and trust are paramount to us. we are unwavering in our commitment to safeguarding your account with the utmost levels of security standards. margin trading we provide custodianship stuff, we make sure your asset is services to both new and safeguarded from any fraud existing clients, with a user- while you work. the outcome of this collaboration is poised to lead to rapid growth for us and assured profits for you. select and invest in an investment plan with seamless ease, initiating your journey towards profitability. we encourage you to thoroughly review the profit options to determine which plan aligns best with your by sharing our platform with others and you can earn profits as you build teams and collect a percentage of all fees!",Yes.
biotradeinvest.info,"ee] trade global financial markets! trade professional solutions for your investment. providing them with services which ar to them and to create awareness regarding reliable and highly profitable investment platform among our clients around the globe. all you need to do is sit back and enjoy how your profit major, minor, and exotic trade cfd leading kyle = santa) ly y 6 = tino lucy attaway = reto aero is y why trade with us? from a list of ( on widely traded indices epresenting a particular arket sector or national",Yes.
aibitinvest.com,"we are an investments innovation firm, committed to the principle of rapid profits generation & capital loss reduction in investing. make profits with their capital from financial monthly average we are a rapidly changing into asset & wealth management company with a mission, to help 27 our investors achieve the most on their capital supported countries with low financial risk exposure and 100% and your capital. you can deposit and offers. invest money and get rewards, withdraw funds in just a few clicks bonus and profits < > : extra fees ; accountability ®@ adecentralized platform available to ®@ we thrive on the accountability and < customers and companies with no transparency our platform. get all the support you need for your investment imesh on our platform with this in mind, we hand-pick the investments we offer on our all active user of the platform are eligible for the affiliate programs. we're committed to making our investors very aibit invest believes in being your trusted partners and earning that trust through confidence and performance in service and support",Yes.
bitcoinera-scam.com,"bitcoin era when dealing with any cryptocurrency platform, security is paramount. section 3: exposing bitcoin era's scam allegations despite the platform's popularity and positive reviews, bitcoin era is not immune to skepticism. section 6: exploiting celebrity endorsements in bitcoin era's deceptive advertising in conclusion, the cryptocurrency trading realm is rife with opportunities, but it also harbors risks, including fraudulent schemes like bitcoin era. bitcoin era when dealing with any cryptocurrency platform, security is paramount. section 3: exposing bitcoin era's scam allegations despite the platform's popularity and positive reviews, bitcoin era is not immune to skepticism. section 6: exploiting celebrity endorsements in bitcoin era's deceptive advertising",No.
zyhold-financialasset.com,"tl lae nasdaq 100- 1 euriusd- 1. biciusd eee cee me tan om select language dad welcome to zyhold- financialasset , thin we are strong supporters of cryptocurrency, blockchain technology and forex trading. we hope to contribute as much as possible to keep the investment community alive and growing. our vision is to develop along with our clients and make zyhold-financialasset.com the finest investment company. our aim is to build a great relationship with you by providing you top quality service. we also monitor the growing market of cryptocurrency, the list of the currencies used in work constantly extends.",Yes.
accesswealth.online,"$ accesswealth poa ont) r pp : ve.e na ' | ya —_ welcome.to access wealth limited eet about us accesswealth.ltd brings together a community of traders and qualified investors dedicating to creating a beneficial and profitable environment for our achievements and experience of specialists allowed us to quickly take a confident position in the market, carry out successful transactions and make a profit. it allowed us ate not only a more significant amount of liquidity, but also to organize a register now !",Yes.
bitcaseairdrop.online,"mears eeu ) o) dee ne eee mel) with a 10% price gain in july, shiba inu (shib) emerged as the second-best performing memecoin in the top 100 cryptocurrency rankings. shiba inu (shib) price gains | social volume, august 2023, source: santiment generally, when social volume rises, it signals increased investor interest and awareness.interestingly, with the flurry of recent product launches, the shib team is taking full advantage of the media hype surrounding its 3-year anniversary. hence, there is a possibility that the hype will evolve into concrete shiba inu gains in the coming days. shiba inu (shib) price prediction 2023/2025/2030 shiba inu (shib) price gains | transaction volume, august 2023, source: santiment considering the close correlation observed between shiba inu's transactional activity and the ongoing media buzz, shib price could deliver more price gains in the coming weeks. read more: crypto signals: what are they and how to | use them read more: top 11 crypto communities to join in 2023 be {in} crypto",No.
bitcoinparaempresas.com,"1) the dawn of bitcoin and the cryptocurrency revolution this was a game-changer in the financial world. just like in a real gold rush, the goal here is to buy low and sell high, but timing the market perfectly is near impossible and should not be your primary strategy. read more about investing in bitcoin, ethereum and other top cryptos 4) the fast-paced world of trading cryptocurrencies at the end of the day, whether you choose to invest for the mid and long term or decide to dive into the fast-paced world of crypto trading, always remember that cryptocurrencies are a high-risk, high-reward game. learn more about quick profits in crypto trading while cryptocurrencies like bitcoin and ethereum are transparent with transactions visible on the blockchain, others offer the cloak of privacy for users. some popular exchanges include binance, coinbase, and kraken. on the other hand, self- managed wallets give you complete control of your crypto but require you to be extra cautious with your private keys. categories crypto investing crypto trading cryptocurrencies education",No.
bitcoinmastery.app,"bitcoin mastery is a cutting-edge platform designed to cater to the needs of avid traders, enabling them to explore and select the most lucrative bitcoin trading opportunities that perfectly align with their unique trading for individuals who may not be well-versed in the process of defining their trading parameters, the following when it comes to navigating the world of trading, it is crucial to have a clear understanding of your risk tolerance, capacity for losses, and your willingness to take risks. to enhance the trading process, it is imperative to establish your unique trading style. it is crucial to choose a trading style that aligns with your experience and goals in order to embark on a more effective and fruitful trading journey. this includes providing your email, phone number, and personal information such as your name. at this stage, you have successfully registered with the bitcoin mastery platform, but your trading account is not yet activated. it is not a security consequently, it becomes imperative to delve into the current number of coins in circulation, which serves as an indicator of the asset's total supply available in the market. however, the rarity of this virtual currency extends even further when you take into account that approximately 20% of the coins, equivalent to around 3.7 million bitcoin, have been irretrievably lost, their whereabouts shrouded in mystery. learn more about the platform services",Yes.
bitcoinguida.it,"financial news __ our experts find new ideas for your business on one hand, it seems that we do not the world with its markets and services market news __ crypto portfolio tracker was able to earn $1.5 million due to funding because of great play in its startup, why it’s better to have experts close the deals ceo of the financial group reports on the market eee ceca) erat ec 4 blockchain can help with fundraising",No.
bitcointrustag.net,"booly’s journey at eurex frankfurt ag ... bool| is set to take on the role of chief executive officer at eurex frankfurt ag, starting from july 1, 2024, succeeding michael peters ... ""| feel very privileged to be appointed as ceo of eurex frankfurt ag according to bloomberg reports the venture capitalist has raised about $315 million ... previously, swiss cryptocurrency bank sygnum ag had successfully funded 35 million swiss francs ($41 million) to support the growth and development of the bank bitcoin 26 jan 2024 the switzerland-based crypto lending platform nexo ag has filed a $3 billion arbitration claim against the bulgarian government for damages and lost opportunities after the latter dropped its money... swiss crypto bank sygnum bags $41m to expand services, acquisitions btc manager 25 jan 2024 crypto bank sygnum raises $40 million, is crypto funding back? coingape 25 jan 2024 coingape 24 jan 2024 the swiss-based crypto lender, nexo ag, a subsidiary of nexo capital in the cayman islands, is seeking $3 billion in damages from bulgaria over an abandoned criminal investigation ... recently, nexo ag . nexo ag files $3 billion arbitration claim against bulgaria finance magnates 24 jan 2024 sec charges american bitcoin academy's founder with $1.2m fraud finance magnates 02 feb 2024",No.
arkfinance.org,"forex is a portmanteau of foreign real estate investment involves the tradeprofits limited now offers all gold is commonly seen as a great surprising as it might be, anyone astock or share (also known as a store of wealth, this precious metal can invest in the oil market to company’s ""equity’) is a financial is also make a profit. our investment plans increase your capital with our real estate, oil & gas investment, earn smart money to be able to buy our investments by contract min, invest: $50,000 min. invest: $5,0 max. invest: $100,000 max. invest: $200,000 payment: instant the prices of ""black gold” and ‘blue fuel for many years kept stable at a high level, that's why it's better to entrust your money to felkeli-ts (el are le the real estate business strive as.the housing price surge higher,comodit market dippens due to fear in the market our expert still keeps the hope alive for our customers and we get going with innovative ideds",No.
