URL,Text,Real Result
accprotrade.com,"4779.5 -1.2 (-0.03%) nasdaq 100+ 16823.8 -1.8 (-0.01%) euriusd + 1.09483 -0.00228 (-0.21%) biciusd 425712 profitabli - ~ investmen in bitcoin | bo oii registered c how accprotrade works? hod ca) ee woes ee a pt eens > 0:00 /0:24 ore we o we world coverage lv] tae our platform is used by bitcoin cee rs ay ts em we po ra ad oe este ie cee ie al iso happy to take the risk to invest in this investment platform after many experience | have with other platform, but today i'm so happy, | just received my profits. bao a aed",Yes.
assets-coin.com,"assets-coin.com is a group of our support is working 7/24 hours online and our online chat support is working about 24 hours daily assets-coin.com is a cryptocurrency trading and investments service company founded by professional brokerage traders who have been working in stock market for more than 10 years licensed under the mission of our company is to provide a reliable and profitable management system for all members. we seek to grow and safeguard the investments of all our clients in a manner that maximizes profitability and trust. we use a dedicated server with the highest level of ddos protection to ensure that your funds are always safe with us. extended validation that verifies the authenticity of our company. we use the highest level of protection our website can resists attacks of any size. our support is working 7/24 hours online and our online chat support is working about 24 hours daily. after 3 months minimum : $1112 maximum : $6500 principal included after 4 months minimum : $6850,00 maximum : $21000,00",Yes.
bit-panda.it,"invest all your investments. all on bitpanda. | ece- | “ commoditie crypto precious s* indices metals auto-invest in the whole crypto market with a *bitpanda stocks enables investing in fractional stocks. keep tabs on your favourite assets all crypto leverage — crypto stocks*  etfs* metals += commodities se ve o® gold . learn all about investing, bitcoin an blockchai it's the. join our online community so you can be the first to hear about company news, new products and more. our bitpanda helpdesk is filled with in-depth articles, and if you need more help, we are always available to lend a helping hand through our contact form. the information we collect is used by us as part of our eu-wide activities.",Yes.
bit-boom.com,"y 2 join it aa ¥ statistics = faq contacts (aus earnings partners every 24 hours auto payment enter your crypto wallet total deposit! @ 01/15/2024 7:55:36 am a @ 29.895087 tpb3edyy2um2dpb...pfcdylv4n we guarantee our investors the confidentiality of personal data and the safety of funds. therefore, we have selected the optimal ratio of profitability and risk when drawing up an investment plan. 3 how can | withdraw funds? 3 how soon will my deposit account be replenished? 3 is there a commission when depositing and withdrawing funds?",Yes.
binarybusinessoptionstrading.com,"cl ese eer re nc eo neem et mune cic icaes choose an investment product to start with. sue em ee cente lae oe ee ee ce se ne ec ec coe een i ss oe ct oe ee ce our re ee eae cs re oms scr or eae a ee eee ceo se neo e oe ee ams against this volatile cryptocurrency market, generating profits for its users ote se eel oe ea ae na wa ee pee ea er se en ae why choose us roc me ent) teena emu cen eon) necn cs} eae r uns ed pcr cn at hola cots tm m tee elt ot wealth. fe} a fe} fe} a a choose plan teme nee a elc) core reu net r inu nc ot or cu ceo) creu ens e",Yes.
bitcoinguider.in,"we'd like to show you notifications for the latest before the invention of money in the history of world humanity, people used the barter method to trade between them. @ bank, blockchain, currency, news ® blockchain banking, blockchain technology banking, crypto banking %™ leave a comment the coin imprisoned in the wallet cannot be used again. the main purpose of the stock certificates is to represent a partnership over ownership. with the increase in value, the valued shares change ... read more crypto, currency, metaverse, news '® crypto certificates, stock certificates % 1. comment metamask allows you to configure these network on their app ,chrome extension easily so you can use it ... read more blockchain, crypto, how to, news, tutorial youtube influencer “wise advice by sumit kapoor” channel scamming people today we are gonna expose how mr sumit or his involment on the scam which is goin on with his name and he is not doing ... read more",No.
airobotrading.co.uk,"24/7 trading with eo we are your trading experts opportunity! receive a free investment strategy adapted to your needs! supervised by your personal risk manager your leap into the profit zone o 24/7 activity with semi- and fully automatic expert advisor what is a expert advisor? @ why are our systems only available to clients staking €100.000 and up? @ what do | have to do to cancel my subscription and stop trading? what can i do? 1) on the one hand, instead of capital in €, it is also possible to deposit capital in the form of bitcoin as trading capital. 2) there is no fee risk for you. a eel treet aed een rene ce a ad ee nea eee teg exchange, cfds, futures) entails a high risk for your assets, up to and including a total loss of the capital employed.",No.
arkinvestdailytrades.com,"hh. latest blogs how to invest in ark etfs how to invest in ark etfs: a guide to strate... ark by cathie wood is still suffering a.. cathie wood's flagship exchange-traded fund hit an all-time high in february of this year. her preferred disruptive-tech chasing strategy may stil be in for .. in vest ‘ark investment management, run by cathie wood, sold more palantir technologies inc pltr -6.39 percent shares on friday, cutting its stake in the... not y ark invest.",No.
bitce.io,"«s bitce welcome to bitce.jo! we concentrate in investing in promising crypto startups. since our founding in november 2023, we have been at forefront of the digital revolution, constantly seeking innovative ‘opportunities for bitce.jo clients. our wide-ranging portfolio spans various sectors, including decentralized finance, blockchain infrastructure, and virtual asset management. sign up today and ‘experience the benefits of investing with a trusted partner who is driven by your success. toe username: =",No.
bitcoinunlimited.org,"pau cee sll tu i il the peer-to-peer electronic cash system for planet earth bitcoin unlimited provides a voice to all stakeholders in the bitcoin ecosystem. q for users 38 for node operators bitcoin is a worldwide peer-to-peer electronic bigger blocks are coming. to the users of bitcoin unlimited, you want your node to be ready. learn more xk for miners i for investors say ""no"" to supply quotas and central planning supporting our objective to lif the block size of the block space market. if there is demand for block space, miners should be free to by removing this limit, continue growing bitcoin in the most simple and learn more bitcoin unlimited software helps the network backbone scale to meet the demands of this global economy.",No.
avacapitaltd.us,"trade the global markets on a top- notch platform. choosing a trading account is always difficult, you need to get acquainted with all account types and choose the best one of them. you can trade, exchange and earn in major crypto assets on our platform. our platform allows you to trade in all major forex pairs. y security your assets are safe and secure with us. y support and with the best traders investment risk are less."" choosing a trading account is always difficult, you need to get acquainted with all account types and choose the best one of them. start seeing results with fully automated trading strategies, personal managers and and protect your assets.",Yes.
bitbondsnft.com,"the future the marketplace purchase and gift, hodl & trade nft wallets that hold your bitb8onds nft bitcoin wallet will always have value. there is value in the btc locked in the wallet. add btc to your nft locked marketplace for the the time value of the nft wallets with trade your nft the locked btc based on the smart contract terms and lock weak hands? lock your bitcoin up for a time period you determine and are bound to via the smart contract terms in the bitbonds nft wallet. or sell your nft wallet on the marketplace. have a question? send us a message if you'd like to learn more!",No.
arnold-bitcoin.trafficzone.online,"arnold schwarzenegger investiert $5.000.000 in ein neues bitcoin trading system - er revolutioniert damit die finanzindustrie (legales, steuerfreies geld in nur 30 tagen!) arnold schwarzenegger, hat $5.000.000 in ein revolutionares neues programm investiert, welches jedem, der geld von zuhause aus verdienen will, eine chance gibt tausende pfund tglich mit der macht der kryptowahrungen zu verdienen. “wir befinden uns in wirtschaftlich schweren zeiten und das ist die lésung, auf die die leute gewartet haben’ sagt arnold. nach seinen kiirzlichen investments in verschiedene kryptowahrungen, erklarte arnold “bitcoin ist besser als wahrung, nie in der geschichte hatten wir eine méglichkeit bei der menschen so einfach den vorteil nutzen kénnen um in so kurzer zeit zu so unglaublichem reichtum zu kommen!” politische unruhen auf der ganzen welt bringen leute dazu, nach einer sicheren und stabilen anlage zu suchen, was den preis von bitcoin im prozess nach oben getrieben hat; es ist komplett dezentralisiert und gibt ihnen zum ersten mal volle unabhangigkeit und schutz tiber ihr geld, weswegen auch schwergewichte wie arnold dazu hingezogen werden. bitcoin wird die welt der finanzen verandern! von zuhause aus geld verdienen ist doch nur ein traum. gerade jetzt ist so eine gute zeit um genau das zu machen.” ich habe mal etwas im internet ausprobiert und es hat nicht funktioniert. ich a habe ungefahr £500 in einem monat verdient aber das war vor 2 jahren.",No.
aarivtrade.com,ann trade fsw col bus our managed strategies serve investors who prefer more tailored investment approaches. access to these strategies are available to all investors. our strategies provide managed exposure to signup in 5 minutes to get an account with us. who we are about us purpose and values regulatory information for all digital asset investors. send link to friends and family to signup with and you get to earn 5% of,No.
alvexglobal.com,wd s fi pw’ ss ‘ pd sts: aly a peer ae] mk ee pa a upto 10% strong customer referral partnership insights cen onstantly l quality & aries more than 6 af 1nva provide years important best of for us services experience lients new to the certificate of incorporation ofa private limited company of companies for united kingdom companies house aegistaar of companies,Yes.
assetslondon.com,"a latest news for: assets london in atrial at london's ... the money, obtained through the fraud, was reportedly used to purchase bitcoin and converted back into cash or high-value assets upon zhang's arrival in london. the city of london corporation, which oversees the square mile finance district, conceded last week that london faced ""a decrease in capital markets activity and assets under management"" -- but... cryptopolitan 31 jan 2024 acquisition takes professional services firm’s aum to £9bn the business desk 31 jan 2024 1.2m sq ft portfolio of industrial and logistics assets has been sold by royal london asset management property across the midlands and south east ... royal london asset management property will continue to asset manage the portfolio for ares. bitcoin 2024 then i realised i was alone metro uk 30 jan 2024 29 jan 2024 31 jan 2024",No.
aitradingmarketcap.com,"aitrading is an award-winning platform that allows a are you to trade global financial markets using bitcoin, usd tether, usdc and more aitrading trading platform to} to} best crypto and forex broker best platform for margin trading best crypto trading app make additional income with covesting earn up to 20% of all profits earned for your followers! earn interest on your crypto a benefit from low fees, fast order execution, and advanced platform our platform is designed to features to increase your profitability your priva leverage is a powerful tool that allows you to open a position much larger in value than the amount you deposited with 1:50 leverage with 1:100 leverage we provide our clients with a wide range of trading tools and features to improve their trading results save on trading fees and benefits from the most competitive trading conditions in the market.",Yes.
bitcoin-prague.com,"bitcoin prague the bitcoin prague app uses superior algorithmic technology to provide users with comprehensive and accurate market analysis that empowers traders to make savvy trading decisions. you will also have the option to customize the amount of autonomy the software operates with and how much assistance the app grants you when trading digital currencies. the bitcoin prague app’s market analysis will give you what you need to make savvy trading decisions that could enhance your trading results. bitcoin prague trading the bitcoin prague official website leverages ssl encryption and other security technologies to ensure that you enjoy a safe and secure trading environment. start trading with the bitcoin prague app? opening a bitcoin prague account should take a few minutes, and once that is done and your account is activated, you will need to deposit funds of at least £250. the bitcoin prague app also offers different levels of autonomy and assistance and so you can customize the app to meet your trading needs and skill level bitcoin prague doesn't charge a registration fee to activate your account, and only trading capital is needed to give you access to the cryptocurrency markets via our powerful trading application. however, you can be confident that the bitcoin prague software will provide you with quality and in-depth market analysis that has the potential of helping you make more informed trading decisions.",Yes.
alpinextrade.com,"being one of the ways we generate income, we have built this platform to make it easy for investors to diversify and invest their capital into cryptocurrency. this has n a proven way that works and we have experts who ensure that not meets eat} we are a known financial and portfolio management company that manages the portfolio of its investors, effectively. we launched this platform to provide hundreds of token & futures trading pairs to help traders to optimize their strategy. we are also one of the top our btc futures trade has nearly $1.58 of volume daily, and the international business companies act chapter 270 of as laws of er revised edition 2000 invest, trade, and manage cryptocurrencies in minutes trading experts blockchain technology our mission alpinextrade.com believes the blockchain technology will eliminate barriers to transactions, increase the efficiency of that changes the world and never stop to innovate and improve on our customer experience",Yes.
asset-manager.fr,"un gestionnaire d'actifs, également connu sous le nom de asset manager, est un expert qui prend en charge la gestion et l'administration de vos investissements, tels que les actions, les obligations, les biens immobiliers ou les placements alternatifs. © stratégie d'investissement : il labore une stratégie adaptée a votre profil d'investisseur et a vos objectifs, en tenant compte des conditions du marché et de votre tolérance au risque. * sélection et allocation d'actifs : il choisit les produits d'investissement les plus pertinents et assure leur répartition optimale au sein de votre portefeuille. confier la gestion de votre portefeuille 4 un expert présente plusieurs avantages : les professionnels de la gestion d'actifs ont accés a un large éventail de produits et de services d'investissement, souvent inaccessibles aux investisseurs individuels. grace a leur expertise, les gestionnaires d'actifs sont capables de maximiser les rendements de votre portefeuille tout en limitant les risques associés. en confiant cette tache a un professionnel, vous gagnez du temps et bénéficiez de la sérénité de savoir que vos actifs sont gérés de mani¢re compétente et efficace. 1. gestionnaires d'actifs indépendants : ils offrent une gamme compléte de services de gestion de portefeuille et sont geénéralement rémunérés par des frais de gestion ou des commissions sur les transactions. 3. sociétés de gestion immobiliére : elles se spécialisent dans la gestion et l'investissement dans i'immobilier et peuvent proposer des services tels que la sélection et l'acquisition de biens, la gestion locative ou le conseil en investissement immobilier. pour sélectionner le professionnel qui saura répondre a vos besoins et attentes, il est important de prendre en compte plusieurs critéres : e la réputation et les références : renseignez-vous sur la notoriété du professionnel et demandez des recommandations a votre réseau ou consultez des avis en ligne pour vous faire une idée de la qualité de ses services.",No.
bitcoinwisdom.com,"bitcoin crypto news, price predictions, investing guides & exchange reviews founded in 2013, bitcoin wisdom strives to provide informative and accurate bitcoin news, price predictions, investing guides and exchange reviews. price predictions investing guides by lawrence woriji november 30, by parth dubey november 30, 2023 comparison guide how to invest in bitcoin robinhood review crypto.com review coinspot review etx review bitcoin news, price predic storm review teg cre eea iy immediate bitcoin review eee bitcoin investor review bitqz review crypto superstar revie creare ey",No.
alxpremiumexchange.com,"eb yee sc rsl we offer the st as investment plans take hold of our world-class investment plans atr e am ate mmm antares nl we v deposit and withdrawal are available at any time. be sure, that your funds are not used in any ongoing trade before the withdrawal. deposit and withdrawal are bes cee aa aurea ee ete een en fee cet mae eee eta) eg een ee ne eee ett esco v clg ener ccn a a",Yes.
bitcoinwealthlife.com,"cryptocurrency exchange ‘there is a cost to trade between different coins, as well as currency exchange fees. it is a business that enables you to trade digital currencies or cryptocurrencies. is keiser report: bitcoin boosting it safe to buy for investment ! how to transfer money from cryptocom to bank account crypto interest ‘where to buy crypto buy cryptocurrency buy bitcoin online cryptocom sign in omi price crypto cryptocurrency exchanges how many btc are there coinbase cryptocurrency prices btc to usd ‘will dogecoin be on coinbase best crypto to buy how to use cryptocom cryptocurrency bitcoin price",No.
2crypto.com,"domain name is a brandable, marketing ready, short and easy to remember domain. this is one of the premium domains we manage, very rare and in demand registered since 2014-05-10 and continuously marketing to find the right company to use this domain brand. use your cryptocurrency to pay for this domain property. the return of investment (roi) of buying exact match domain name is a long-term strategic value-added to your business, comparable to the marketing cost in advertisement e.g., television ad, newspaper, media advertising, radio, billboard and other labor costs. your audience is global without boundaries to represent your company products and services. your domain string will work 24x7x365 non-stop promoting your products and services. if you need assistance to purchase this domain name property, please don't hesitate to let us know by sending email to one of the email addresses below. bb linkedin @ facebook fd email =< more | founder, a shout for joy! email support@que.com for assistance to purchase your next brand. email: support @que.com for ad inquiry.",No.
bitcoinformula.net,"bitcoin formula is an innovative trading platform dot it offers a unique opportunity for traders to explore and select the most lucrative bitcoin trading options based on their individual preferences and trading style dot through this platform, users can collaborate with an account manager, customize their trading parameters, and gain valuable insights into effective trading strategies that align with their unique approach dot ensuring the security of funds and user information is a top priority for the bitcoin formula platform dot in this instance, you will be trading against bitcoin with another currency. by registering an account with a broker, you unlock a plethora of trading tools to aid you in your trading endeavors. with these powerful tools at your disposal, you will be empowered and your trading experience will be greatly improved. almost all of it is in circulation in addition, assessing the number of coins currently in circulation provides insights into the asset's total supply available in the market. however, the scarcity of this digital currency reaches unprecedented levels when you consider that approximately 20% of the coins, roughly 3.7 million bitcoin, have been irrevocably lost, their whereabouts now shrouded in mystery. learn more about the platform services",Yes.
bitcoinmillionaires.tv,"cout millionaires porn aortas} eae ror sn gao arose re est pa eek aco oc ekof a? mrm eee u ren cnc uke a eeu ron meu ke et sr gem re as a e ech ari ek me eur pee eur eae) eg ote enue on iese oe ula eee se ree oc cultural and political ramifications that this technology can create; featuring interviews with bitcoin and teen ene resta roce i ae eee mere regi fe our mission: help support our film: if you are interested in sponsorship, product-placement or investment opportunities please serid us a message lyon alo lar ucerelea ack) ; ra poi ha nt ae; eer yee and advertising e he ne rc tee",No.
bit-es.co,"investment platforms in the digital age: a new era of personal finance ‘al innovations in by al aug 14, 202: blockchain in fintech: more than just cryptocurrencies the evolution of money: from barter to bitcoin and beyond oc the ethical dimensions of game game development: crafting virtual realities for global communities bridging worlds: the evolution of social gaming platforms in the last 10 years immediate avapro review how technology is the transformation shaping the future of retail: adapting of consumer to modern behavior consumer needs by al oct 20, 202:",No.
bitcoinmagnet.info,iaproveche la oportunidad de beneficiarse de la oferta exclusiva’ de bitcoin magnet! {> fete aca eee +383 usd cémo aprovechar la oferta: localice el formulario de registro en el sitio web de bitcoin magnet. jentre en el reino de las inversiones en criptodivisas con condiciones 6ptimas! ce em i or ee ceretmt tee ee ae amt oc a ley las inversiones me llev a explorer nuevas oportunidades. bitcoin magnet me ofreci6 una oportunidad unica de invertir en criptodivises. qué es bitcoin magnet? $quién puede invertir en criptomonedas en bitcoin magnet? parte de bitcoin magnet y emprenda un camino préspero en el reino de las inversiones en criptomonedas. the success of those in the testimonials and other examples are exceptional results and therefore ere not intended as a guarantee that you or others will achieve the same results. this website is not responsible for your actions.,Yes.
alphatradecrypto.com,"”a with features like stop loss/take profit, and trailing stop you can manage your losses and profits at the levels predetermined by you explore and trade cfds on major, minor, and exotic currency pairs with efficient spreads. safe and secure all data on the alpha trade crypto platform is secured with a state of the art high level security become your own bank by investing and saving up your money at same time completed a transfer completed ethereum © completed bitcoin il ethereum completed il bitcoin completed bank [ © completed | transfer bitcoin bank [ © completed | transfer",Yes.
adiva-investments.com,"about team portfolio contact s8english q andreas eracleous 5 jens leinert director advisory board adiva investments or its shareholders are involved in the following projects and companies lepr ne bitcoin q with btcpaywall you can sell individual blog posts (pay-per-post), videos (pay-per-view), digital products and receive donations. your customers can easily pay via bitcoin and lightning besides the sale of physical goods, a main focus is the sale of digital goods. internetactive support payment processing via bitcoin and lightning payments. your email address (mandatory) company name",No.
administrationassets.com,"a latest news for: administration assets the insolvency administrator's report has already analyzed the financial situation of the company, its assets, and liabilities ... the facilities and other assets should be sold in a single lot, thus facilitating the continuity of operations srinagar- the administrative council (ac) which met.... this is in pursuance to the process of outsourcing of the assets of tourism department. ... with crypto assets ... the proposed amendments are part of an ongoing project by the canadian securities administrators (csa) to develop a comprehensive regulatory framework for crypto assets in canada. they were also asked to initiate legal action against violators and to remove the cages from the houses, as the cooperation in this regard would “certainly assist in saving the valuable national assets”, 22 jan 2024 22 jan 2024 21 jan 2024 22 jan 2024 22 jan 2024",No.
