URL,Text,Real Result
arducrypto.com,"do more with ardu crypto a first-class cryptocurrency exchange platform with a user-friendly environment. built with superior technology, it fulfils the highest security standards with optional multi-factor authentication on our app that puts you in control. transfer your crypto to the most secure custody solution, with technology provided by leading global firms - ledger enterprise and fireblocks. get verified in less than 5 minutes with your proof of identity and proof of address using selfie verification and start owning your favorite cryptocurrencies. v what cryptocurrencies are available for trading on ardu crypto? v how secure is ardu crypto? v can | use ardu crypto on my mobile device? v is ardu crypto suitable for beginners? v does ardu crypto offer customer support? v how to open an account with ardu crypto?",Yes.
assets.financial,"news publish currency etf healthcare crypto bond more + subscribe = q © 21 january 2024 © 20 january january 2024 blackstone, the world's largest alternative asset, manager, is doubling its private equity business headcount in singapore over the next two years. the justice ministry in japan has begun utilizing artificial intelligence (al) to expedite the release of english translations of laws and regulations. the s&p 500 reached a record high close on friday, driven by optimism in artificial intelligence and gains in heavyweight technology stocks, particularly chipmakers, this rally confirms that the s&p 500 has been in a bull market since october 2022, ending a bear market that began in january 2022. se. japanese prosecutors have indicted individuals from three factions within the ruling liberal democratic party (ldp) over a political fundraising scandal, but they did not indict executives due to a lack of evidence. january 2024 tomoko tamura has become the first woman to lead the japanese communist party (jcp). and allegations _settai in japan ofslushfunds 901 © 21 january 2024",No.
auth0-test.futurityinvest.com.au,"pt ag planning for your family’s life-long education is a big responsibility and futurity can make that important task a lot easier with our dedicated range of savings and investment products. issuer of tax-effective education bonds, designed to support life events and educational aspirations. innovative, tax-effective solutions to help you save and invest for your family’s education bonds with an expansive investment menu and a find out why futurity education bonds are a view our range of education bonds and smart choice for tox effective investing, and explore the options available to your and understand the investment bond rules. secure a st of education cale eee) te eee a dereon sol before you act on any advice in this website please consider whether itis appropriate to your personal circumstances. you should also read the relevant product disclosure statement and download the application form which are both available on our website, or you can obtain a copy by calling us on 1300 345 456.",No.
bancabitcoin.net,"how etfs affected btc futures trading in the u.s. cryptoslate 16 jan 2024 the launch of the spot bitcoin etfs in the u.s ... while the impact it could have on the global bitcoin market, like legitimizing it as an asset class or creating more demand, has been analyzed at length, few have focused on its effects on other regulated investment products like futures ... bitcoin also exhibited significant volatility last week. after the approval of the 11 spot bitcoin etfs, the bitcoin (btc) price shot up significantly, nearing $49,000 ... amid the declines, a crypto analyst sold off a substantial share of his bitcoin holdings to acquire ethereum (eth). following last week's launch of 11 spot bitcoin exchange traded-funds (etfs) in the united states, matt hougan, chief investment officer (cio) at bitwise, has offered a compelling perspective on the potential impact of these etfs on the bitcoin market ... spot etfs could have impact like 1.4 bitcoin halvings. bitcoin bullish signal sees btc price at $50k in q1/2024 coinchapter 16 jan 2024 qcp capital bitcoin price ... new delhi (coinchapter.com) — bitcoin (btc) might be looking at a bullish signal from a technical indicator that has historically preceded “massive” bull markets for the token, according to a crypto trader ... ichimoku breakouts might be the next big >bitcoin bullish signal. coingape 16 jan 2024 the price of bitcoin (btc) has fallen as the current rally ends at a high of $49,048. contrarian bets appear to have been proven correct, as the long-awaited approval of a bitcoin spot exchange-traded fund (etf) turns out to be a “sell on news” event. korea times as",No.
binaearnmoney.finance.blog,"binainvestments binainvestments is a reliable, trusted and automated online crypto currency investment platform with a team of professional traders focusing mainly on bitcoin and other crypto currencies trading over multiple exchanges and markets.anspa trade limited was incorporated under the companies act 1993 on the 23rd day of march 2015, new zealand. we make it safe and easy to invest in crypto currencies worldwide.our expert team has worked all over the world for top tech and finance companies such as google, amazon, morgan stanley and barclays. plus we're backed by some of the world’s top investors.to be more exact, super-efficient. this is how we see the processes that work towards generating profit, because our unique cluster-type trading neural networks provide us with methods and tools for error-free trading. these methods and tools are completely inaccessible to all other competitors. they are constantly learning, consistently and safely giving us income from cryptocurrency trading, as well as constantly generating profits on forex, stock and commodity exchanges.we enable crypto investors to generate and earn profits on daily basis as they invest.the profits are been generated in accordance to the package selected and capital utilized during the trading period.our trading packages “\ “/ § starter package minimum amount: $200maximum amount: $5,000profit: 12% ul duration: 4 daysreferral commission: 7%standard package © minimum amount: $5,050maximum amount: $12,000profit: 20% i! privacy & cookies: this site uses cookies. by continuing to use this website, you agree to their ceo tiles) use. to find out more, including how to control cookies, see here: cookie policy = thomaskenneayaot w marcn 24, 2025 wr uncategorizea ma leave a comment",Yes.
alphavisiontrade.com,"pme 5 ern over 570+ assets available with best in class trading tools oe btcusdt 42102.96 -17.67 (-0.04%)  ethusdt 2279.25 + seven years of impeccable service required to [o} on] professional traders (if you can’t trade on your own). trading, crypto currency trading and stock trading with dedicated corporate te lat mel mm at=i-(ele] what is bitcoin mining? felmesh=s1cecon nva traders from all over the world trust alphavisiontrade.",Yes.
247-crypto-currencies.investerscorp.com,"currencies 247 crypto currencies most of our users earn a profit on the first day of trading with us. you can trade with us on your smartphone by downloading our highly intuitive trading app. the fact that you can access this page means that we are available in your country. fund your 247 crypto currencies account with a minimum of $250. these brokers are adequately regulated, and hence your money is safe with them, + 1.247 crypto currencies is a trading app that makes bitcoin trading accessible to all. this means that you can earn up to 4 times your invested capital on the first day of trading with us. remember that all trading comes at significant risk and hence only trade with what you can afford to lose. when you signup to 247 crypto currencies a broker is automatically assigned to you.",Yes.
assetscoin.net,"a get it on the app store is the utility token of the ecosystem we want convert income into the token from by joining us, you will become a part of our ecosystem and promote it as best as you can because the greater the adoption, the more benefits for you. we generate income from all our products and activities like buy and property with profit renting for stability app/game/dex/launchpad/investments nft marketplace for your and more.. for you and for us! you can just sell or hold to earn more super simply with potential! - reserve found (locked - not for sell) - public / strategic sell-options - marketing / development - future listings / lq pool - uniswap listing in the case of $asset token distribution, we plan to convert up to 100% of our netto income, depending on the situation, or planned reinvestments to always increase income, which is in the interest of all holders and investors. our system should allow for continuous development important information - itis in the interest of every investor to promote the project because the greater the involvement and the greater the inflow of capital, the greater the benefits for the holders all tokens will be distributed to sasset token holders proportionally to the number of tokens they own. the distribution of rewards in the form of $asset tokens in the three cases mentioned above on our website, as our token purchases for community distribution, will depend on our token sales,private and vc, which we accept at a minimum of $75,000 to 2.000.008 at first stage. this will allow us to generate and multiply profits to buy tokens from the market at market prices. disclaimer by engaging with the assetcoin platform and its associated tokens, particularly $asset, you acknowledge and accept the following terms and conditions:",Yes.
assets-exodus.com,"nd buy crypto, view your nfts, and explore web3 on q if ies —- eo: pes pro oa c+ ia ed ox cra er) oi ed roe bc or ae manage crypto on desktop manage your portfolio with the built-in swap feature and rewards app a new world of crypto apps es y 2 e & * ro wo =— es o sd & live charts & portfolio built-in swap 24/7 human support exodus wallet & trezor all-in-one wallet to secure, manage and swap blockchain assets cn [ e-a  o 6 e ce se ee e a cs) f ee cy el ea ln cod swap assets between trezor and exodus sign up to receive our newsletter with updates about your wallet.",No.
bitcoin360aitrading.com,"al trading in 3 al the bitcoin 360 al trading platform is designed for simplicity and ease, ensuring that you can our risk-free demo mode offers a hands-on experience, allowing you to understand our unique at bitcoin 360 al, we are connect with the trading platform and harness the might of bitcoin 360 al embark on smarter and more lucrative live trading, leveraging our superior al as your trading “though | had my doubts regarding the assertions of bitcoin 360 al, after my preliminary investment and a few months of use, i've been blown away by the precision of its forecasts and indications.” the platform. 53 bitcoin 360 al ully review the terms & conditions and the disclaimer segment of the",Yes.
4oceancapital.com,"iw cu]. | rr 4 ocean capital uses advanced ai robots trained on extensive trading data and algorithms to analyze market trends and execute profitable trades with high precision. our al bots maintain an average 5% daily pnl. et aed one rem oo ees oe nn te seco su ee acy navigate uncertainty with 4 ocean capital reece ae ten re nro eter eae) des etme re eet ae seca eens eee et mane rec) ea nrc cenc eget [ecu ee eo cua eee oe coe os st) tether $1.00 com ery ce parco ar eeu tema oom ada 0.49% peers acest 4 ocean capital doesn't just follow trends - it & = ry pioneers them. trade from anywhere whether you're at home or on the go, seize market opportunities anytime, anywhere, and secure your financial future effortlessly. eee",Yes.
bitcoin-magazin.info,"bitcoin-magazin coins tauschen  wallet_—bitcoinkaufen = testbericht + empfehlung neues kontakt in aufgrund der winsche unserer kunden haben wir ein aktuelles chartsystem des bitcoin preises eingefiihrt, welcher im 5 minuten takt aktualisiert wird. bewerten sie ihre bisherigen investments doch mal mit bitcoin (btc) zum vergleich: wert des bitcoin am: 03.07.2018: 5.886 € bleib giber bitcoin informiert. funltianiar ditanin? aamit aisin danta aaha der ,,digitale dollar“ ist nina ealla newsletter yield nodes deutsch masternoding - wer ist yieldnodes in deutscher sprache yieldnodes und wie erhdlst du ein passives... hier die infos was yieldnodes unterscheidet in deutscher yieldnodes seite https://bit-ly/35sy780 yielnodes sprache.",No.
arabwealthmanagement.net,"al anbat 27 jan 2024 in line with the rapid growth of the wealth management market in india, mirae asset established a branch in dubai, united arab emirates, becoming the first korean asset manager to enter the middle east. .. management and the director of community programs at the arab youth climate movement-qatar, will share their wealth of knowledge on recycling and the significance of preserving the environment. arab news 26 sep 2023 “the scale of the transition is very substantial, of course, and the hydrocarbon economies have to manage very deftly this transition away from what has been a source of huge wealth,” he told arab news. arab news 26 sep 2023 “the scale of the transition is very substantial, of course, and the hydrocarbon economies have to manage very deftly this transition away from what has been a source of huge wealth,” he told arab news. dubai, united arab emirates - media outreach - 8 august 2023 - bybit, one of coingecko's top five most trusted crypto exchanges, is delighted to announce the launch of its wealth management product. arab wealth management the peninsula 26 jan 2024 the economic times 27 jan 2024",No.
ardennes-trade.com,"seize the opportunity to grow your capital in the most liquid market in the world by copying the trades of top traders in our investment our trading centers and ed trading with us k in 15 days forex and a trans} jobally, we are all over the world. our /frontend we have experts in the fields of cryptocurrency trading our relentless team has years of experience in the fields of cryptocurrency trading is well known to many professional investors in the field of cryptocurrency. in er the official registration of our company, joining a ade.com became available to everyone who is.",Yes.
best-traders.co,"he stress from searc! india budget 2024: season 2 finale episode ends ona high note learn with etmarkets: mastering gold, silver trading with macd, fibonacci retracements the s&p bse sensex rose more than 400 points, while the nifty50 closed above do you want to advertise with us? (7) best a) traders risk disclosure: trading in financial instruments and/or digital currencies involves high risks including the risk of losing some, or all, of your investment amount, and may not be suitable for all investors. before deciding to trade in financial instrument or digital currencies you should be fully informed of the risks and costs associated with trading the financial markets, carefully consider your investment objectives, level of experience, and risk appetite, and seek professional advice where needed, best-traders.co would like to remind you that the data contained in this website is not necessarily real-time nor accurate. the data and prices on the website are not necessarily provided by any market or exchange, but may be provided by market makers, and so prices may not be accurate and may differ from the actual price at any given market, meaning prices are indicative and not appropriate for trading purposes. best-traders.co and any provider of the data contained in this website will not accept liability for any loss or damage as a result of your trading, or your reliance on the information contained within this website. best-traders.co may be compensated by the advertisers that appear on the website, based on your interaction with the advertisements or advertisers.",No.
bitcoinpriceusd.cloud,"the history of bitcoin’s valuation in usd: a timeline 2009-2010: the humble beginnings + january 2009: bitcoin network came into existence with the mining of the “genesis block.” + october 2009: the first recorded bitcoin exchange rate was established, valuing bitcoin at $0.000764 per coin. + february 2011: bitcoin achieved parity with the us dollar, hitting the $1 mark. 2013: the first bubble and regulatory concerns « april 2013: bitcoin’s price soared to $266, a meteoric rise from just $13 at the start of the year. « december 2013: bitcoin price plummeted to around $600 after china banned financial institutions from using bitcoin. « february 2014: the infamous mt. gox exchange declared bankruptcy, causing bitcoin's value to drop to $450. + may 2020: bitcoin underwent its third “halving,” reducing miner rewards by 50%, which led to increased scarcity and pushed the price to around $9,000. the history of bitcoin’s valuation in usd is a tale filled with ups and downs, marked by high volatility and significant events.",No.
assetmanagers.io,"pa oes perse ears se easiccy vis eee coy f reed ese watch on youtube alternative video results what does an asset manager do? published: 06 analysts foresee this major asset manager asset management is a systematic process of deploying, operating, maintaining, upgrading, and disposing of assets cost-effectively. the term is most commonly used in the financial world to describe people and companies that manage investments on behalf of others. alternative views of asset management in the engineering environment are: the practice of managing assets to achieve the greatest return (particularly useful for productive assets such as plant and equipment), and the process of monitoring and maintaining facilities systems, with the objective of providing the best possible service to users (appropriate for public infrastructure assets)",No.
bitcoin2go.org,"invest all your investments. all on bitpanda. invest in fractions of your favourite companies without committing to a whole share () *bitpanda stocks enables investing in fractional stocks. for more details see the prospectus at bitpanda.com. keep tabs on your favourite assets all crypto leverage — crypto stocks*  etfs* metals += commodities se ve o® gold . learn all about investing, bitcoin an blockchai it's the. join our online community so you can be the first to hear about company news, new products and more. our bitpanda helpdesk is filled with in-depth articles, and if you need more help, we are always available to lend a helping hand through our contact form. featured in 5 ,",Yes.
bitchaingloballtd.com,"i market analysis we've spent years on what you can now get with just a few clicks! with the help of our al, we receive fife pel lolol olen \e)e-1e) aire (0) ame) trading in the market! cluster market analysis is a modern and highly accurate method of price forecasting based on the detailing of the volumes included in the asset. the modern trader is forced to work with a huge amount of data, because the market is constantly changing. learn how to invest step by step with bit chain global company. step 3 step 4 choose the investment plan that you more get daily profit up to 3.5% and withdraw it at interested and make a deposit. any time to your external wallet. we spend a lot of time to research tons of different trading strategies from top companies to collect all best practices and the most necessary experience in one place. with us you are completely protected. ma eteleig faqs contact acne as privacy",Yes.
arkglobalequity.online,aeg we provide a range of investment options to protect individuals and businesses against the risk of financial losses in return for regular payments of premiums. pec we think digital investments should be more about living. © sil mo cryptocurrecny forex trading stocks trading make money from the comfort of your home we think life investment should be more quick and easy for all. so we've designed our procedure to be easy and safe for all our users. ark provides a range of investment plans to protect about us features faq,Yes.
bit-panda.sk,"invest all your investments. all on bitpanda. auto-invest in the whole crypto market with a *bitpanda stocks enables investing in fractional stocks. keep tabs on your favourite assets all crypto leverage — crypto stocks*  etfs* metals += commodities st wae ©® gold . on the crypto horizon learn all about investing, bitcoin an blockchai it's the. join our online community so you can be the first to hear about company news, new products and more. our bitpanda helpdesk is filled with in-depth articles, and if you need more help, we are always available to lend a helping hand through our contact form. the information we collect is used by us as part of our eu-wide activities.",Yes.
bitcoinminersuk.com,"bitcoin miners uk started out and is still based in central london; we ha’ een involved in bitcoin hardware and we ep we will still be selling bitcoin mining hardw hardware for mining other cryptocurrencies s we want to some time on a problem that w with bitcoin and cryptocurrencies in general, the v lity! e, we explain this here, we do @ that are pre-mined and we don't sell hardware to work with such coins. day for the uk and offer all other pricing on our hardware and",No.
airlightindextrades.com,"sinem ie nct)xed xe) sign up a british publicly t ompany he juipped with the knowledg basic plan classic plan poe expert plan —_ 9 9 — ° > 8% 16% al 24% profit after 24hrs profit after 24hrs — profit after 3 days aay — ~ ws minin > min in pes minin » _— > max invest > max invest > max invest be > fast withdrawals > fast withdrawals > fast withdrawals £ 35 bonu: nus > principal included principal include j j liz y y j 4 me ir, j pelelele es | j vip plan — °. a > min in » =a) comes > max invest: unlimited . begin promoting through your unique link in articles, social media, ads, and other forms of content, and earn free money every time that your referrals make a deposit. for every investment they make, you will gain a part of the attractive affiliate commission our company offers upto 5%. y ethereum",Yes.
akwealth.in,"ou +91 9869450303 abhishek.kadam.5@gmail.com grow wealth (ir) financial services investment | insurance | income tax irdai certified insurance advisor (cia) sensex coo |_swver__ | cnute usin euro uk yen 72.05.63 531500 ru05709, 5033.00 sais 20.5600 4353 s008 saaoiz asin) + -sisan (ei 285.60 ars0(zeam) 4 40058 (h000%) | 08180 059%) | 4-070 (082k) | 4-07808 (129%) at grow wealth financial services our mission is to provide financial freedom to our clients through financial planning and wealth management techniques. we distribute mutual fund products insurance planning is a critical health insurance covers the for short, medium & long term as component of a financial plan that potential expense of hospitalization per one's need. you can choose from includes evaluating risks and due to illness or accident. that can various categories as per your determining the proper insurance protect you and your family from requirements. retirement is one of the most create a legacy that provides fixed deposits are deposits where important life events that many of us supports the causes and charities a particular sum of money is will ever experience. this is that you care about, and maintains your invested for a fixed duration. give shape to your investments.... 5 ; — ener couns cause ey",No.
bitcointrustco.com,"latest news for: bitcoin trust co the letter, produced by samoural wallet and ten31 and co-signed by river, strike, ronindojo, swan bitcoin, primal, griid, zaprite, peach, mempool space, upstream .. regard, the co-signers state. krypto-adoption: 580 millionen menschen halten bitcoin und co. bitcoin 25 jan 2024 blast from the past: dogecoin blockchain immortalizes 1993 video game ‘doom’ this game redefined... https.//t.co/yschvcsyrb pic.twitter.com/gwxzkqufee. — lookonchain (@lookonchain) january 25, 2024... 2... 1. thread by lookonchain (https.//t.co/nqmntz3syt) showing mac and his friends selling savm for millions in profits. coingape 25 jan 2024 oasys, a blockchain company specializing in games, announced on the 25th that it has entered into a strategic partnership with pacific meta co., ltd., a web3 comprehensive consulting firm, with the... the decision of the us regulator came a day ahead of the deadline on january 25 ... next date that matters is may 23rd https.//t.co/22bbvhkrvk— james seyffart (@|seyff) january 24, 2024. after bitcoin, its ether russia's top diplomat accuses u.s., south korea and japan of preparing for war with north korea",No.
aurora-trader.investerscorp.com,"ere a =u mame a loe how aurora trader works? aurora trader is a tested and proven trading platform. most of our users earn a profit on the first day of trading with us. fund your aurora trader account with a minimum of $250. these brokers are adequately regulated, and hence your money is safe with them. moreover, there is no limit to how much you can deposit with us. + 1. aurora trader is a trading app that makes bitcoin trading accessible to all. aurora trader is the only free robot that generates daily profits of up to 60%. you can start trading with us today by signing up through the link below. when you signup to aurora trader a broker is automatically assigned to you.",No.
