URL,Text,Real Result
bitcoininstitute.net,bitcoin institute.net ‘al system and protection from get ben’s book on amazon. contents ony a pane ‘the prablen bic sens ew bin bese what moy? bitcoin’s rate of adoption is running at about double the pace of internet adoption during the 1990s. what is bitcoin? ‘what is money? ‘the mechanics of bitcoin. is bitcoin a good investment? is bitcoin secure? is bitcoin too difficult to change?,Yes.
bitcoincoinproject.buzz,"in exchange futures secondsfutures pledge ieo assets g english q 4 met coin is the easiest place to buy and sell cryptocurrencies. sign up now and get started )) news project publicity 2015-12-31 16.00.00 | seemore > currency price 24h vol daily rise and fl nearly 3 days © srewsor 42139.99 16732162.6458 -0.28% * ethusdt 2263.74 6015757.0984 -0.28% * pn ‘@ ada/usdt 0.4909 89596.4199 -0.08% + x xreiuspt 0.5273 7431204.5686 -0.42% > bi votuspt 6.899 43.54% nile, ac the world's leading digital asset trading platform deliver secure, trusted digal asset trading and aset management services to millns of users in more than 130 countries worldwide . professional distributed architecture and anti-ddos attack forms start your digital currency journey now provide you with the most convenient digital currency transaction method sign up about us user support help center contact us customer service platform introduction © howtoregisterby what is deposit and emaili fh fh email how to deposit —youcoin001@gmail.com project publicity how to authenticate what is withdrawal : privacy policy sorecneaaten aston rat:",Yes.
biacoinvest.com,"eee ee ere an on cus read more invest regi refer now! for instant eee) a we are strong supporters of cryptocurrency, blockchain technology and forex trading. we hope to contribute as much as possible to keep the investment community alive and growing. our vision is to develop along with our clients and make biacoinvest.com the finest investment company. we also monitor the growing market of cryptocurrency, the list of the currencies used in work constantly extends. we invite you to join us on this journey!",Yes.
bitcoinloophole.cash,"bitcoin loophole bitcoin loophole trading the app enables you to trade cryptocurrencies and provides you with valuable information and insights into the crypto market in real-time. it is highly intuitive and easy to customize, and you can adjust the autonomy and assistance levels to match your skills and needs as a trader. the app only serves as a trading tool that provides comprehensive analysis of the crypto market in real-time. trading cryptocurrencies is easy with the bitcoin loophole app, and it only takes a few minutes to join our community and beneftt from our app. step two requires a minimum deposit of £250, which will serve as your trading capital and will enable you to open positions in the crypto market. after these steps, you are ready to embark on your trading journey and benefit from the bitcoin loophole app that provides you with real-time analysis of the crypto market. the app provides you with accurate analysis of the crypto market in real-time and these insights will help you to make more informed decisions in your trades. the bitcoin loophole app only requires a web browser and an internet connection and you can then gain direct access to valuable information and analysis of the crypto market in real-time. the app is entirely free, and you can use it to trade a wide range of cryptocurrencies, including bitcoin.",Yes.
acryptos.pages.dev,"you can find and download the is bitcoin banned in australia files here. you can download the is the blockchain secure files here. in background, oct 04, 2021 you can get the why is bitcoin on the stock market files here. you can get the is bitcoin legal in germany files here. can you buy crypto on robinhood with unsettled funds are a topic that is being searched for and liked by netizens today. in background, oct 04, 2021 you can get the eth price 2021 files here. in background, oct 04, 2021 how to mine bitcoin with cpu on windows and linux images are ready. you can find and download the how to mine bitcoin with cpu on windows and linux files here.",No.
bitcoinwarrior.net,"published by benzingain the wake of a booming global electric vehicle (ev) market, chinese ev titan byd co ltd (otc:byddy) (otc:byddf) is, published by city amby maria ward- brennan the self- proclaimed inventor of bitcoin is set to appear at the high court today as a trial gets. of crypto predicts a significant shift in bitcoin's (crypto: bitcoin expected to plummet further to $38k, according to 10x research published by benzingabitcoin (crypto: btc) may potentially witness a drop to the $38,000 level, as per the prediction by 10x research. the cryptocurrency is. published by benzingathe securities and exchange commission is, predicted to delay the approval of spot ethereum (crypto: eth) exchange-traded funds (etfs), according to investment. and floki’s tokenfi surges 33% in 7 days amid slow week for meme coins after blackrock’s larry fink bets big on tokenization wh happened: tokenfi is up 33% in the last. published by benzingathe crypto fear and greed index, a measure of market sentiment, indicates that enthusiasm in the bitcoin (crypto: btc) market has receded",No.
aqarchain-io-frontend-6dr.pages.dev,"digital ownership certified on the property is minted as an nft and further fractionalized into property share tokens for investment. oe oa ce cstr st through agarchain tokenization platform as a buyer the investor will buy a property. custodize and management of the pr don the blockchain and has legal standing other private document bi the property share token trx hash is mentioned on y buy and sell with a click of a mouse or a tap on the app create a portfolio of property shares 10 have successfully ve make sure that listed on agarchain are within the completion stage of 24 to 36 months this allows enough time for property to gain capital appreciation in value project completion. since the investment is by agarchain to the developer, the yield for the off plan property during the tenure of development is guaranteed by the property developer. ties and property developers success record guaranteed high yield on capital appreciation on",No.
assetcoin-traders.co,"lets grow up and make your profits grow our company was formed to utilize advanced cloud mining-technology to mine for cryptocurrencies. choose your plan mining starts immediately after payment max 999 usd ever aus period : 48 hours pss sols by 7s s(libey authomatic withdrawal authomatic withdrawal select plan deposit total percent total profit promote assetcoin traders limited ltd & earn weare introducing the assetcoin trader limited referral program. now you can get up to 10% from each purchase that your referral makes. stable hashrate and mining with the most pbetyi-bolmel-yoless ime) 100% uptime profitable mining pools coins to your account is this day incorporated under the companies act 2006 as a private company, that the company is limited by shares, and the situation of its registered office is in england and wales taken steps to ensure that we have the processes, technology to deliver the highest level of service and support to our customers.",Yes.
bestelitetrade.com,"best elite trade is an award-winning platform that allows you to trade global financial markets using bitcoin, usd tether, usdc and more best elite trade trading platform best platform for margin trading new to trading? trade with the best benefit from low fees, fast order execution, and advanced platform features to increase your profitability a leverage is a powerful tool that allows you to open a position much larger in value than the amount you deposited our customer service team works 24/7 to provide you with an that in difficult times there are people that will support you and help you make more money, thank you best el best elite trade’ products and services are designed to meet the needs of both new and professional",Yes.
360tradespro.com,ee a your access to+. des - oy _ s cir reem cereale eres lcp ae i vy a ’ create free account y aa) a ~? trade professional solutions for your investment. fund your account invest reem eno co eg ae qjrades pro al strives to be worthy of our client ing them with servic e and trade cfds ot ee john wayne y with us? invest with us and eam up to a i a) of leena ’ piel) aa ete ce) ea ere eam,Yes.
altexminers.com,"a mdi) i we offer the most secured crypto trading and investment solution on the globe we’re on a mission to democratize finance for all. with our experience and safe approach to trading, we can manage more capital and offer our investment platform to the public and at the same time guarantee you our continued credibility and success in the journey. our service your financial life, all in one place a cee eu see ce om mt rees e  aen e earn 5% commission every time if your downline made a deposit. “lam writing to thank you for the quality of service provided by testimonial altexminers company. sincerely appreciate your efficient, gracious customer service, the level of detail you have demonstrated and the way your business is conducted as a whole” e words from our investors.",Yes.
aimexxcapital.com,"00 aimexx capital company v markets pricing plans contact us faq's account v crary we do more for your world a © (a daily charges stable income your deposit works for we work around the you exactly as much as clock - this means that you wish, and accruals your money is constantly are made every day. thstant payments professional team ——<—$—___| a ee getting your profit is very we have many years of simple - you make out an experience working on application in your stock exchanges and in personal account and in the sphere of a moment you will cryptocurrency mining — receive money on your you can completely wallet. comfort and protection 2417 support your charges are our managers are displayed in your always ready to answer personal cabinet, you the questions you are can acess it from any interested in - contact us device, and all your in any convenient way accounts are securely and you will receive the encrypted. 4 at —= ae create account make deposit make withdrawal click on the create account button and now that you have gotten anew account _itis time to enjoy your labour. a verification on aimexx capital, login to your dashboard —_and capital will be credited to your account email will be sent to you, verify your and select the deposit plan that best fits after investment duration and you can account and that is it. www.llocalbitcoins.com — www.blockchain.info www.paxful.com www.coinbase.com you can buy bitcoin with you can buy bitcoin with you can buy bitcoin with you can buy bitcoin with localbitcoins.com by clicking —_blockchain.info by clicking on __paxful.com by clicking on the —_—_coinbase.com by clicking on on the link above the link above. i've been on the lookout for a reliable and user-friendly investment platform, and i'm thrilled to say that my search ended with aimexx capital.",Yes.
bitarexfx.com,"investment increase the values of your cryptocurrencies and eliminate loss. simple and most secured platform for cryptocurrencies investment. sign up for a secure wallet to store all your cryptocurrencies. kindly click on any plan of your prefered choice from your account balance if you wish to invest. legal company our system is well detailed to enable easy access to all our services and investment on the platform. legal company our system is well detailed to enable easy access to all our services and investment on the platform. plan 30% duration: daily. we are acredited trading company with 6 years in a forex market. we introduce bitarexfx platform and technology to help users who can not trade profitably in a forex market to earn by investing in our platform. [’ve been in bitarexfx investment for a few months, they le company in the market.",Yes.
bitcoin-buyer.live,"what is bitcoin? bitcoin is a decentralized digital payment system its history dates back to 2008 when the famous bitcoin whitepaper was published by an today, the value of one bitcoin is measured in tens of thousands of dollars, and its total market capitalization - the combined value of all coins - is nearly $590 billion. so, what makes bitcoin so attractive that it managed to evolve from a peculiar and obscure phenomenon to the most popular cryptocurrency with such a massive market capitalization in a relatively short period? bitcoin is a currency that can be used regardless of geographic location and political situation, without being tied to a bank and its limitations. additionally, the unique structure of the storage system in the form of an unbroken chain of blocks makes the data nearly impervious to fraudulent activities. it's a straightforward, convenient, and innovative method of conducting transactions, which could become the foundation of the future economy. pay and receive how to buy what is itez? > where is the best place to buy bitcoin?",No.
bitcoin-aktien.com,"in diesem artikel werden wir die besten méglichkeiten erkunden, um bitcoin in euro oder andere fiat-wahrungen umzuwandeln. in diesem blog-artikel werfen wir einen blick auf die ... weiterlesen wenn du ein tieferes verstandnis fur die funktionsweise von bitcoin und die aktivitaten auf der blockchain erlangen méchtest, kénnen analyse-tools und -seiten dir dabei helfen, die datenflut zu bewaltigen und ... weiterlesen bitcoin % ein kommentar die zukunft von bitcoin und aktien: eine vielversprechende investitionsméglichkeit mit der steigenden akzeptanz von bitcoin als zahlungsmittel und der zunehmenden anzahl an unternehmen, die bitcoin als teil ihrer geschaftsmodelle integrieren, ist das potenzial fiir zukiinftiges wachstum ... weiterlesen die zukunft von bitcoin: warum es sich lohnt, jetzt in kryptowahrungen zu investieren eine der ... weiterlesen wahrend bitcoin die aufmerksamkeit der welt auf sich zieht und als revolutionare digitale wahrung gilt, bieten aktien die méglichkeit, in etablierte unternehmen zu investieren und an ihrem erfolg teilzuhaben. @ aktien, bitcoin % ein kommentar wahrend bitcoin als kryptowahrung die welt im sturm erobert hat, bieten aktien traditionell eine solide méglichkeit, in etablierte unternehmen zu investieren.",No.
bitcoin-profit.co,"the bitcoin profit trading app advantages even for a flexible crypto trading app where processes are automated for the best interests of the user, there is just so much more that’s available for traders. the bitcoin profit trading app, as aforementioned, has the best interest of its clients and part of this is their dedication to better serve their traders. crypto by itself is technology, and technology is “seen” in the bitcoin profit trading app. *) bitcoin profit trading app clients the bitcoin profit trading app is required to deposit usd not crypto. and not just any money. the bitcoin profit trading app is designed nn specifically for this. why exactly should you join the platform? first, bitcoin profit trading app is a portal for exploiting opportunities in crypto. in the midst of this financial revamp of the global monetary and fiscal systems where control is decentralized back to the user; not the middleman, there is a chance for all of our clients to make money and change their lives.",Yes.
anabitcointrade.com,"professional trading on cryptocurrency and forex, make profit on money of the future today! $ 87488777.14 bm aarel acd eee a ded a > = )' . my es ee me oe = mt 22) ee saas = ee ly secret ee a brean) ete ae cees i uz al aoe re ifstant, and your withdrawal = tt ca nese crem rou ce prune iet an er gr aft rd eee ee oe our withdrawals are all processed instantly met encod ee cca mols “ana bitcon trader llc "". cr ce cua eee neca reta and pe re eee ee",Yes.
bintrextrades.com,"your financial dream come true buc daa a ee) oe eee ce) a ‘the bill and melinda gates foundation are introducing an, a des es cee ee teen eae open-source software to facilitate the creation of payment, complete decentralization, realistically, blockchain pe oe ae ues aw tery eee ecr tee ee at ree eee ue ce esd to facilitate and melinda gates foundation are introducing, an open-source software to facilitate the creation of korea ees cy eee while cryptocurrencies might look like an incredibly eee ore een ee er eae ds pen eee se even been adopted by countries such as australia and everyone is on board. tene een cen ee ce a vg interface for generating ethereum wallets & more. eae we ne",Yes.
bestowedfx.com,"trade cfds on 1000+ markets. bestowed fx ctrader is your own strategies on our sophisticated desktop tablet smartphone automate use signals let a cbot trade for you trade using free, in- - eliminate mistakes platform signals, and benefit from provided by trading higher speed and central. you can access our investment we run all our tradings on fast and highly secured servers located in us and the uk. trading have been tested and proven to be the very best you can get any time any where. trade with the lowest commissions globally we keep our spreads raw and charge very low or no shares © etfs ao by commissions. indices 0 py that's how the interbank market works and we keep wg this structure, given our vast experience in liquidity. the more you trade, the higher the reductions on your commissions. we offer the lowest eurusd our liquidity is sourced from tier- when we speak about raw q@ average spread in the world, at q@ | liquidity providers, such as q@ spreads, we really mean that we 0.083 pips.",No.
bestbtcsites.com,our mission is to keep you inforn ting genuine payouts and diligently checking the status of hyip projects. ulapaido.com review: 104% to 170% after 1 day | 130% to 750% after 7 days | (100% rcb) week ) sp sanz - amin (brick-community.com review: 102% to 110% after 1 day | 130% to 210% after 7 days | (100% rcb) week ) rewline.io review: 1% to 2 for 10 to 40 days (100% rcb ucoinshark.cc review: 8% to 15% daily for 15 to 30 days / 300% after 7 days (100% rcb) rewline.io review: 1% to 2 for 10 to 40 days (100% rcb earnmoneytips.info review about epaycore epaycore: it is an online payment method that can be easily used by users who make online investment transactions. ‘safeassets bestbtesites.com jan + 4min : usafeassets.com review: 0.24% - 0.50% daily for 1 - crypto 12 months. 396 views 18 comments 16 7 rs bestbtesites.com ‘ j sani + 4min i trends cryptocurrency investors should follow in scam - adneza.com review: 104% to 182% at day (100% rcb).,No.
andex-trade.com,"[ie] n= (e100 no nl (0 xo) sign in sign up. ele ret re mc se rms sera rrl te) rea cua ace een en mor naman r elt we are a uk registered broker, our andex-trade.com is registered and is located in london. our uk registered number is 13047680. you can download the pdf file. the features of our company our referral program some feedback from our investors and in last thanks admin for the best project. | am a investor in this project and my feedback for this project is with 5 stars.",Yes.
bitcoin-price-usd1.top,"in this article, we will delve into the factors that might influence its future price and what one might expect for bitcoin’s valuation in the years to come. the past years have seen increased institutional interest in bitcoin, from companies like tesla to major banks offering bitcoin investment options. the more mainstream financial entities adopt and endorse bitcoin, the higher its potential for growth. friendly regulations can boost confidence and drive up the price, while stricter rules and potential bans can deter investors. improvements in the underlying technology, scalability solutions, or the emergence of new use-cases (like defi) can have a bullish impact on bitcoin’s price. economic downturns or financial crises could result in higher demand for decentralized assets like bitcoin. predictions & speculations 1. bullish outlook many analysts believe bitcoin's price will continue to rise in the long term due to its deflationary nature, increasing institutional adoption, and its position as the dominant cryptocurrency. predictions in this camp range from $100,000 to even $1 million per bitcoin in the next decade. skeptics argue that bitcoin could face significant downturns due to potential regulatory crackdowns, technological vulnerabilities, or a shift in investor sentiment. predicting bitcoin’s future price is a complex endeavor, requiring an understanding of a myriad of factors and the ability to",No.
bitcoin-profits-way.com,"bitcoin profits way bitcoin profits way join us and start trading cryptocurrency for free even in a bear market, traders can seize numerous opportunities, and bitcoin profits way is an ideal companion on this journey. diverse range of assets - trade a wide selection of cryptocurrencies like bitcoin, ethereum, monero, bat, and iota with bitcoin profits way. bitcoin profits way trading discover a new world of cryptocurrency trading with bitcoin profits way software - unveiling your path - move 1 - journey 2 - phase 3 embark on your trading journey by creating a complimentary bitcoin profits way account on our authorized platform. now that your trading account is active, proceed to fund it. whether you are a novice or an experienced trader, our reliable and innovative bitcoin profits way app offers a winning strategy for digital currency trading. is the bitcoin profits way software costly for cryptocurrency trading?",Yes.
bancoprofit.ltd,"join a team of experts and professional cryptotraders. our company offers of the highest quality. invest in our tariff plans and receive up to 10% of profits in hourly. ___g 10% 30% eee pea fom atures emac) fom atures emac) @ min: 50 usd fom reel) fom ree tu) omy ree lu) deposit now | deposit now | welcome to bancoprofitltd our passion into a lucrative investment banco opportunity for everyone. nnr ae cours a a to achieve good growth and create a competitive investment platform, bancoprofit.ltd has created through the affiliate program, you (0) al (0) aa will profit from the deposits made by the people you invite. our features ree can a rt a",Yes.
ai-trade.in,ye pres about us au lor login itachi —__ join future of algorithmic crypto secure payment een ue id snes le re sirs) reece sc jan 2023/2024 dt elf’ lereliteee ctem di emda) ee ree ones sree) alena ot fun and addictive game.,No.
bitcoinxox.app,we also provide hundreds of tutorials to help you learn the tricks of online trading and investing bitcoin xox is your best platform for tools and resources to take your trading game to the next level. bitcoin xox provides all the tools you need to make it in online investing and trading. you need to sign up with us on this page to access our tools. bitcoin xox is the best partner for all your trading needs. you have all the reasons to try us since we offer all our resources for free. read all read all demo and tutorials learn more about bitcoin you can access all the bitcoin xox resources after funding your account. please watch our video tutorials to learn how to use our platform. bitcoin xox is your best bet if you are looking for tools for trading and investment research. we are also the one-stop shop for everything you need to know about online trading and investing.,No.
bitcoinbankpte.net,"latest news for: bitcoin bank pte “long-term target for bitcoin price is $400,000” us skybridge founder predicts market price after halving successive listing of solana spl tokens ... render is a solana-based stock that was listed on bitbank in september last year as the first company in japan to do so ... connection .. connection two phases of a bull market ... in this market, there is a view that the market movement will be divided into two phases ... source. although the daily price has fallen to the 90-day moving average line, is it difficult ... masayuki sanada/bitbank market analyst bitbank market analyst... at bitbank, she contributed to the company’s media. bitcoin has dropped over 20% from its three-year high reached shortly after the u.s ... bitcoin retreats post-etf approval surge ... yuya hasegawa, crypto market analyst at japanese bitcoin exchange bitbank, sald ... bitcoin ... featured image from shutterstock the achievement marks a momentous step forward for the ecosystem, which has rapidly gained traction within the creator and web3 community ... vitruveo achieved the milestone through the sales of its booster and super booster nfts ... vtru (bvi) pte ltd. 29 jan 2024 31 jan 2024 31 jan 2024",No.
axitrade.ltd,"get 100% payout on as little as 0.1 pip a trading platform for online trading and investments from the broker olymp trade. highlow options bact ee a eee ere mmm) meee mcc at mee ea eee ere mmm) meee mcc at mee ea dms ae cc ke et ce ea eee ute ace te een asec pacem tee eee tee introduction to cryptocurrency trading cor eu aeal been keane cto ie uo ere nt) pec me acs en tne ke te cm cee st ona ret es c ee nac at io rem a meee em rcs tem ste reenter ae ay itll late ee ar lestu mee m ere tlc em nel ome uvc b emt mmol mell moe lom cele) eel =e re tlle le a libero ipsam recusandae omnis laudantium cum ratione, voluptates, numquam illum iusto, at +",Yes.
